{
  "schema_version": 1,
  "meeting_id": "9f1d1308-7c64-4e94-9540-67a4522bd2c1",
  "snapshot_revision": 1,
  "meeting": {
    "code": "PH-2026-001",
    "title": "Triển khai nền tảng họp không giấy",
    "status": "APPROVED",
    "scheduled_start": "2026-08-03T08:00:00Z",
    "started_at": null,
    "ended_at": null
  },
  "actor": {
    "user_id": "678eae11-dc26-468b-9afc-17b5938e2278",
    "display_name": "Nguyễn Văn A",
    "role": "CHAIRPERSON",
    "permissions": ["VIEW", "JOIN", "CONTROL", "EDIT_MINUTES", "APPROVE_MINUTES", "EXPORT_DRAFT"]
  },
  "participants": [
    {
      "user_id": "678eae11-dc26-468b-9afc-17b5938e2278",
      "display_name": "Nguyễn Văn A",
      "role": "CHAIRPERSON"
    },
    {
      "user_id": "7c810d2a-7d01-4169-a834-3633ef56059c",
      "display_name": "Trần Văn B",
      "role": "MEMBER"
    }
  ],
  "hotwords": [
    {"term": "Nguyễn Văn A", "weight": 1.0, "source": "participant"},
    {"term": "VNPT", "weight": 1.0, "source": "manual"}
  ]
}
